content_id,title,type,tags,description,mood_tags,difficulty,duration,link
67,Mindfulness-Based Stress Reduction (MBSR),article,"MBSR,mindfulness,stress,Jon-Kabat-Zinn,programme","Jon Kabat-Zinn's 8-week programme: the most evidence-based mindfulness intervention. What it involves, what the research shows, and how to access it free online.","stress,anxiety,depression,chronic-pain,overwhelmed",intermediate,14 mins,https://www.mindfulnessstudies.com/what-is-mbsr/
68,The Freeze Response: Shutdown Explained,article,"freeze,dorsal-vagal,shutdown,dissociation,polyvagal","The least-discussed trauma response: freezing and shutting down. Why it happens, what it feels like (numbness, fog, paralysis), and how to gently activate from freeze.","dissociation,trauma,depression,low_energy,overwhelmed",intermediate,10 mins,https://www.psychologytoday.com/us/blog/the-therapist-is-in/202001/why-people-freeze-in-the-face-of-danger
69,Compassion Fatigue and Caregiver Burnout,article,"compassion-fatigue,caregiving,burnout,empathy,boundaries","The hidden cost of caring for others. Signs of compassion fatigue, how it differs from burnout, and a recovery plan for caregivers, therapists, and helpers.","burnout,exhaustion,sadness,anger,overwhelmed",intermediate,11 mins,https://www.psychologytoday.com/us/blog/compassion-matters/202103/compassion-fatigue-and-empathy-fatigue
70,Values Clarification Exercise (ACT),article,"values,ACT,meaning,purpose,direction","Identify your core values — the compass that guides committed action in ACT. Includes the 60-value sort exercise and guidance on setting values-aligned goals when depressed.","low_motivation,sadness,depression,hopelessness,existential",beginner,20 mins,https://positivepsychology.com/values-clarification/
71,Crisis Text Line: How It Works,article,"crisis,support,text,immediate,safety","Free 24/7 crisis text support for mental health emergencies. How it works, what to expect, and when to use it. Text HOME to 741741 in the US.","crisis,panic,overwhelmed,sadness,anxiety",beginner,3 mins,https://www.crisistextline.org/
72,Emotional Regulation Skills (DBT),article,"DBT,emotion-regulation,skills,coping,therapy","The DBT emotion regulation module: how to identify emotions, reduce vulnerability to emotional mind, act opposite to urges, and check the facts.","anger,overwhelmed,anxiety,sadness,low_self_esteem",intermediate,15 mins,https://dialecticalbehaviortherapy.com/emotion-regulation/
73,Interpersonal Effectiveness (DEAR MAN),article,"DBT,relationships,assertiveness,communication,DEAR-MAN","DBT's DEAR MAN skills: Describe, Express, Assert, Reinforce, Mindful, Appear confident, Negotiate. The most practical script for assertive communication in relationships.","anger,relationships,low_self_esteem,anxiety,stress",intermediate,10 mins,https://dialecticalbehaviortherapy.com/interpersonal-effectiveness/dear-man/
74,Understanding Panic Disorder,article,"panic,disorder,agoraphobia,avoidance,treatment","What happens in the brain and body during a panic attack, how panic disorder develops, and why the treatment (exposure, not avoidance) feels counterintuitive but works.","panic,anxiety,agoraphobia,avoidance,overwhelmed",beginner,9 mins,https://www.verywellmind.com/panic-disorder-overview-1393203
75,Self-Harm: Understanding Urges,article,"self-harm,urges,coping,safety,DBT","A compassionate, non-judgmental guide to understanding self-harm urges — why they occur, what function they serve, and distress tolerance alternatives from DBT.","crisis,overwhelmed,sadness,self-harm,anger",intermediate,8 mins,https://www.mind.org.uk/information-support/types-of-mental-health-problems/self-harm/
76,Motivational Interviewing Basics,article,"motivation,change,ambivalence,MI,therapy","How motivational interviewing resolves ambivalence about change — the stage of change model and strategies to move from contemplation to action.","low_motivation,ambivalence,change,addiction,procrastination",intermediate,10 mins,https://motivationalinterviewing.org/understanding-motivational-interviewing
77,The Mind-Gut Connection,article,"gut,microbiome,anxiety,depression,serotonin","90% of serotonin is made in the gut. The bidirectional relationship between gut microbiome and mental health — and what you can eat to support your emotional wellbeing.","anxiety,depression,stress,overwhelmed",beginner,9 mins,https://www.hopkinsmedicine.org/health/wellness-and-prevention/the-brain-gut-connection
78,Dr Gabor Maté: Trauma and the Body,video,"trauma,addiction,ADHD,compassion,healing","World-renowned trauma expert Dr Gabor Maté explains how childhood trauma shapes adult physiology, disease, and addiction — and why compassion, not willpower, heals.","trauma,addiction,low_self_esteem,sadness,anger",intermediate,40 mins,https://www.youtube.com/watch?v=BVg2bfqblGI
79,EMDR Demonstration Session,video,"EMDR,trauma,PTSD,bilateral,therapy","Watch a live EMDR session demonstrating bilateral stimulation, desensitisation, and installation phases. Demystifies the therapy and shows what to expect.","trauma,PTSD,anxiety,insomnia",intermediate,45 mins,https://www.youtube.com/watch?v=hKrfH43srg8
80,Dr Julie Smith: Why Has Nobody Told Me This?,video,"CBT,therapy,skills,emotions,mental-health","Clinical psychologist Dr Julie Smith's most popular videos — practical mental health skills for managing panic, low mood, motivation, and self-esteem. Clear, warm, non-clinical.","anxiety,sadness,low_motivation,panic,low_self_esteem",beginner,varies,https://www.youtube.com/@DrJulie
81,5-Minute Mindfulness Bell Meditation,exercise,"mindfulness,quick,bells,awareness,pause","Set a recurring bell sound every 5 minutes during your day. At each bell, take one conscious breath. This micro-mindfulness practice has been shown to significantly reduce stress.","stress,anxiety,overwhelmed",beginner,ongoing,https://www.mindful.org/mindfulness-bells-mindfulness-bell/
82,Worry Postponement Technique,exercise,"anxiety,worry,postponement,CBT,scheduled","Schedule a specific 15-minute daily worry time. When anxious thoughts arise outside this window, write them down and postpone them. Reduces total worry time by 35% in studies.","anxiety,stress,overthinking,insomnia",beginner,daily,https://www.psychologytools.com/self-help/worry/
83,Morning Sunlight Protocol,exercise,"sleep,circadian,energy,morning,cortisol","Get 10 minutes of direct sunlight within 30-60 minutes of waking. Andrew Huberman's most recommended single intervention for sleep, mood, and energy — backed by photoreceptor research.","insomnia,low_motivation,sadness,low_energy,depression",beginner,10 mins,https://hubermanlab.com/using-light-for-health/
84,Cold Plunge for Mood Elevation,exercise,"cold,dopamine,mood,energy,resilience","Deliberate cold exposure (3-8 minutes at 10-15°C) produces a 2.5× increase in dopamine and norepinephrine lasting 3+ hours. Protocol from Dr Susanna Søberg's research.","low_motivation,sadness,low_energy,stress,depression",advanced,10 mins,https://www.youtube.com/watch?v=pq6WHJzOkno
85,Radical Acceptance Practice (DBT),exercise,"DBT,acceptance,radical,distress-tolerance,pain","Radically accepting reality as it is — not as you wish it were — is the pivotal DBT distress tolerance skill. Includes a step-by-step practice and the distinction between acceptance and approval.","overwhelmed,anger,sadness,crisis,grief",intermediate,15 mins,https://dialecticalbehaviortherapy.com/distress-tolerance/radical-acceptance/
